{
  "$extensions": {
    "io.utopiasoft.design": {
      "profileVersion": "0.1.0"
    }
  },
  "x": {
    "$type": "number",
    "$value": 5
  },
  "spacing": {
    "xxs": {
      "$type": "dimension",
      "$value": {
        "value": 2.5,
        "unit": "px"
      },
      "$extensions": {
        "io.utopiasoft.design": {
          "derivation": "x*0.5"
        }
      }
    },
    "xs": {
      "$type": "dimension",
      "$value": {
        "value": 5,
        "unit": "px"
      },
      "$extensions": {
        "io.utopiasoft.design": {
          "derivation": "x*1"
        }
      }
    },
    "sm": {
      "$type": "dimension",
      "$value": {
        "value": 10,
        "unit": "px"
      },
      "$extensions": {
        "io.utopiasoft.design": {
          "derivation": "x*2"
        }
      }
    },
    "md": {
      "$type": "dimension",
      "$value": {
        "value": 15,
        "unit": "px"
      },
      "$extensions": {
        "io.utopiasoft.design": {
          "derivation": "x*3"
        }
      }
    },
    "lg": {
      "$type": "dimension",
      "$value": {
        "value": 20,
        "unit": "px"
      },
      "$extensions": {
        "io.utopiasoft.design": {
          "derivation": "x*4"
        }
      }
    },
    "xl": {
      "$type": "dimension",
      "$value": {
        "value": 30,
        "unit": "px"
      },
      "$extensions": {
        "io.utopiasoft.design": {
          "derivation": "x*6"
        }
      }
    },
    "xxl": {
      "$type": "dimension",
      "$value": {
        "value": 40,
        "unit": "px"
      },
      "$extensions": {
        "io.utopiasoft.design": {
          "derivation": "x*8"
        }
      }
    },
    "xxxl": {
      "$type": "dimension",
      "$value": {
        "value": 60,
        "unit": "px"
      },
      "$extensions": {
        "io.utopiasoft.design": {
          "derivation": "x*12"
        }
      }
    }
  },
  "radius": {
    "xs": {
      "$type": "dimension",
      "$value": {
        "value": 5,
        "unit": "px"
      },
      "$extensions": {
        "io.utopiasoft.design": {
          "derivation": "x*1"
        }
      }
    },
    "sm": {
      "$type": "dimension",
      "$value": {
        "value": 7.5,
        "unit": "px"
      },
      "$extensions": {
        "io.utopiasoft.design": {
          "derivation": "x*1.5"
        }
      }
    },
    "md": {
      "$type": "dimension",
      "$value": {
        "value": 10,
        "unit": "px"
      },
      "$extensions": {
        "io.utopiasoft.design": {
          "derivation": "x*2"
        }
      }
    },
    "lg": {
      "$type": "dimension",
      "$value": {
        "value": 15,
        "unit": "px"
      },
      "$extensions": {
        "io.utopiasoft.design": {
          "derivation": "x*3"
        }
      }
    },
    "xl": {
      "$type": "dimension",
      "$value": {
        "value": 20,
        "unit": "px"
      },
      "$extensions": {
        "io.utopiasoft.design": {
          "derivation": "x*4"
        }
      }
    },
    "full": {
      "$type": "dimension",
      "$value": {
        "value": 9999,
        "unit": "px"
      }
    }
  },
  "border": {
    "hairline": {
      "$type": "dimension",
      "$value": {
        "value": 1,
        "unit": "px"
      }
    },
    "thin": {
      "$type": "dimension",
      "$value": {
        "value": 1.5,
        "unit": "px"
      }
    },
    "thick": {
      "$type": "dimension",
      "$value": {
        "value": 2,
        "unit": "px"
      }
    }
  },
  "shadow": {
    "sm": {
      "$type": "shadow",
      "$value": [
        {
          "color": {
            "colorSpace": "srgb",
            "components": [
              0,
              0,
              0
            ],
            "alpha": 0.05098,
            "hex": "#000000"
          },
          "offsetX": {
            "value": 0,
            "unit": "px"
          },
          "offsetY": {
            "value": 1,
            "unit": "px"
          },
          "blur": {
            "value": 6,
            "unit": "px"
          },
          "spread": {
            "value": 0,
            "unit": "px"
          }
        }
      ]
    },
    "md": {
      "$type": "shadow",
      "$value": [
        {
          "color": {
            "colorSpace": "srgb",
            "components": [
              0,
              0,
              0
            ],
            "alpha": 0.14902,
            "hex": "#000000"
          },
          "offsetX": {
            "value": 0,
            "unit": "px"
          },
          "offsetY": {
            "value": 2,
            "unit": "px"
          },
          "blur": {
            "value": 10,
            "unit": "px"
          },
          "spread": {
            "value": 0,
            "unit": "px"
          }
        }
      ]
    },
    "lg": {
      "$type": "shadow",
      "$value": [
        {
          "color": {
            "colorSpace": "srgb",
            "components": [
              0,
              0,
              0
            ],
            "alpha": 0.34902,
            "hex": "#000000"
          },
          "offsetX": {
            "value": 3,
            "unit": "px"
          },
          "offsetY": {
            "value": 3,
            "unit": "px"
          },
          "blur": {
            "value": 14,
            "unit": "px"
          },
          "spread": {
            "value": 0,
            "unit": "px"
          }
        }
      ]
    }
  },
  "fontWeight": {
    "regular": {
      "$type": "fontWeight",
      "$value": 400
    },
    "medium": {
      "$type": "fontWeight",
      "$value": 500
    },
    "semiBold": {
      "$type": "fontWeight",
      "$value": 600
    },
    "bold": {
      "$type": "fontWeight",
      "$value": 700
    }
  },
  "duration": {
    "xs": {
      "$type": "duration",
      "$value": {
        "value": 100,
        "unit": "ms"
      }
    },
    "sm": {
      "$type": "duration",
      "$value": {
        "value": 150,
        "unit": "ms"
      }
    },
    "md": {
      "$type": "duration",
      "$value": {
        "value": 200,
        "unit": "ms"
      }
    },
    "lg": {
      "$type": "duration",
      "$value": {
        "value": 300,
        "unit": "ms"
      }
    },
    "xl": {
      "$type": "duration",
      "$value": {
        "value": 400,
        "unit": "ms"
      }
    }
  },
  "breakpoint": {
    "tablet": {
      "$type": "dimension",
      "$value": {
        "value": 600,
        "unit": "px"
      }
    },
    "web": {
      "$type": "dimension",
      "$value": {
        "value": 900,
        "unit": "px"
      }
    },
    "sidebar": {
      "$type": "dimension",
      "$value": {
        "value": 1000,
        "unit": "px"
      }
    }
  },
  "color": {
    "primary": {
      "$type": "color",
      "$value": {
        "colorSpace": "srgb",
        "components": [
          0.043137,
          0.517647,
          0.34902
        ],
        "alpha": 1,
        "hex": "#0b8459"
      }
    },
    "accent": {
      "$type": "color",
      "$value": {
        "colorSpace": "srgb",
        "components": [
          0.870588,
          0.470588,
          0.070588
        ],
        "alpha": 1,
        "hex": "#de7812"
      }
    },
    "field": {
      "$type": "color",
      "$value": {
        "colorSpace": "srgb",
        "components": [
          0.929412,
          0.929412,
          0.929412
        ],
        "alpha": 1,
        "hex": "#ededed"
      }
    },
    "canvas": {
      "$type": "color",
      "$value": {
        "colorSpace": "srgb",
        "components": [
          0.960784,
          0.960784,
          0.960784
        ],
        "alpha": 1,
        "hex": "#f5f5f5"
      }
    },
    "error": {
      "$type": "color",
      "$value": {
        "colorSpace": "srgb",
        "components": [
          1,
          0.321569,
          0.321569
        ],
        "alpha": 1,
        "hex": "#ff5252"
      }
    },
    "disabled": {
      "$type": "color",
      "$value": {
        "colorSpace": "srgb",
        "components": [
          0.741176,
          0.741176,
          0.741176
        ],
        "alpha": 1,
        "hex": "#bdbdbd"
      }
    },
    "text": {
      "$type": "color",
      "$value": {
        "colorSpace": "srgb",
        "components": [
          0,
          0,
          0
        ],
        "alpha": 0.866667,
        "hex": "#000000"
      }
    },
    "surface": {
      "$type": "color",
      "$value": {
        "colorSpace": "srgb",
        "components": [
          1,
          1,
          1
        ],
        "alpha": 1,
        "hex": "#ffffff"
      }
    },
    "border": {
      "$type": "color",
      "$value": {
        "colorSpace": "srgb",
        "components": [
          0.909804,
          0.917647,
          0.941176
        ],
        "alpha": 1,
        "hex": "#e8eaf0"
      }
    },
    "rowAlt": {
      "$type": "color",
      "$value": {
        "colorSpace": "srgb",
        "components": [
          0.968627,
          0.972549,
          0.984314
        ],
        "alpha": 1,
        "hex": "#f7f8fb"
      }
    },
    "hover": {
      "$type": "color",
      "$value": {
        "colorSpace": "srgb",
        "components": [
          0.937255,
          0.945098,
          0.972549
        ],
        "alpha": 1,
        "hex": "#eff1f8"
      }
    },
    "chipBackground": {
      "$type": "color",
      "$value": {
        "colorSpace": "srgb",
        "components": [
          0.905882,
          0.917647,
          0.992157
        ],
        "alpha": 1,
        "hex": "#e7eafd"
      }
    },
    "chipForeground": {
      "$type": "color",
      "$value": {
        "colorSpace": "srgb",
        "components": [
          0.043137,
          0.517647,
          0.34902
        ],
        "alpha": 1,
        "hex": "#0b8459"
      }
    },
    "hint": {
      "$type": "color",
      "$value": {